[
  {
    "id": "0a11ce00-0000-4000-8000-000000000001",
    "name": "operator",
    "role": "write",
    "enabled": true,
    "last_sign_in_at": "2026-10-08T14:02:11Z",
    "totp_enrolled": true
  },
  {
    "id": "0a11ce00-0000-4000-8000-000000000002",
    "name": "ops2",
    "role": "write",
    "enabled": true,
    "last_sign_in_at": "2026-05-21T08:03:12Z",
    "totp_enrolled": true
  },
  {
    "id": "0a11ce00-0000-4000-8000-000000000003",
    "name": "readonly",
    "role": "read",
    "enabled": true,
    "last_sign_in_at": null,
    "totp_enrolled": false
  }
]
